title	author	descr	ISBN	ISBN13	genres	imagePath
A Message to Garcia	Elbert Hubbard	Before becoming the basis for two motion pictures, A Message to Garcia was written as an inspirational essay by Elbert Hubbard. This popular work is about a soldier who takes the initiative to accomplish a daunting and difficult task without questions or objections and graciously accomplishes the task. Often used in business and life as a motivational example to readers of applying a positive attitude towards achieving a successful life.	159986942X	9781599869421	War > Military,Fiction,Philosophy,Leadership,War	A_Message_to_Garcia.jpg
Sophie's World	Jostein Gaarder	A page-turning novel that is also an exploration of the great philosophical concepts of Western thought, Sophie’s World has fired the imagination of readers all over the world, with more than twenty million copies in print.<>One day fourteen-year-old Sophie Amundsen comes home from school to find in her mailbox two notes, with one question on each: “Who are you?” and “Where does the world come from?” From that irresistible beginning, Sophie becomes obsessed with questions that take her far beyond what she knows of her Norwegian village. Through those letters, she enrolls in a kind of correspondence course, covering Socrates to Sartre, with a mysterious philosopher, while receiving letters addressed to another girl. Who is Hilde? And why does her mail keep turning up? To unravel this riddle, Sophie must use the philosophy she is learning—but the truth turns out to be far more complicated than she could have imagined.	1857993284	9781857993288	Fiction,Philosophy,Classics,Novels,Roman,Modern,European Literature > German Literature,Magical Realism,Spirituality	Sophie's_World.jpg
Angels & Demons  (Robert Langdon, #1)	Dan Brown	When world-renowned Harvard symbologist Robert Langdon is summoned to a Swiss research facility to analyze a mysterious symbol—seared into the chest of a murdered physicist—he discovers evidence of the unimaginable: the resurgence of an ancient secret brotherhood known as the Illuminati ... the most powerful underground organization ever to walk the earth. The Illuminati has now surfaced to carry out the final phase of its legendary vendetta against its most hated enemy—the Catholic Church. <>Langdon’s worst fears are confirmed on the eve of the holy conclave, when a messenger of the Illuminati announces they have hidden an unstoppable time bomb at the very heart of Vatican City. With the countdown under way, Langdon jets to Rome to join forces with Vittoria Vetra, a beautiful and mysterious Italian scientist, to assist the Vatican in a desperate bid for survival. <>Embarking on a frantic hunt through sealed crypts, dangerous catacombs, deserted cathedrals, and even the most secretive vault on earth, Langdon and Vetra follow a 400-year-old trail of ancient symbols that snakes across Rome toward the long-forgotten Illuminati lair ... a clandestine location that contains the only hope for Vatican salvation.	1416524797	9781416524793	Thriller > Mystery Thriller,Mystery > Crime,Novels,Adult Fiction,Religion,Fiction,Fantasy,Mystery	Angels_&_Demons__(Robert_Langdon,_#1).jpg
How the Steel Was Tempered	Nikolai Ostrovsky	В настоящую книгу вошел роман советского писателя Н.Островского "Как закалялась сталь", где в яркой художественной форме раскрывается образ молодого борца революции Павла Корчагина.	0714705853	9780714705859	Literature > Russian Literature,Cultural > Russia,Classics,Fiction,War,Literature,Classics > Classic Literature	How_the_Steel_Was_Tempered.jpg
War and Peace	Leo Tolstoy	Tolstoy's epic masterpiece intertwines the lives of private and public individuals during the time of the Napoleonic wars and the French invasion of Russia. The fortunes of the Rostovs and the Bolkonskys, of Pierre, Natasha, and Andrei, are intimately connected with the national history that is played out in parallel with their lives. Balls and soirees alternate with councils of war and the machinations of statesmen and generals, scenes of violent battles with everyday human passions in a work whose extraordinary imaginative power has never been surpassed. <>The prodigious cast of characters, seem to act and move as if connected by threads of destiny as the novel relentlessly questions ideas of free will, fate, and providence. Yet Tolstoy's portrayal of marital relations and scenes of domesticity is as truthful and poignant as the grand themes that underlie them.	0192833987	9780192833983	Classics,Fiction,Historical Fiction,Cultural > Russia,Literature,Literature > Russian Literature,War,Novels,Literature > 19th Century	War_and_Peace.jpg
Pinocchio	Carlo Collodi	Geppetto's new puppet can not only dance and turn somersaults, but also talks and misbehaves--and longs to be a real boy.	0140382623	9780140382624	Classics,Fantasy,Childrens,Fiction,European Literature > Italian Literature,Fantasy > Fairy Tales,Adventure,Cultural > Italy,Literature	Pinocchio.jpg
You Can Heal Your Life	Louise L. Hay	If you haven't seen Hay House's Lifestyles series of gorgeous gift books, there is no better way to acquaint yourself than with publisher/author Louise Hay's <>You Can Heal Your Life<>. A bestseller for many years, <>You Can Heal Your Life<> has been republished with bright, beautiful illustrations in full, living color and exquisite typography--each and every page is a work of art by artist Joan Perrin Falquet. The timeless message of the book is that we are each responsible for our own reality and "dis-ease." Hay believes we make ourselves ill by having thoughts of self-hatred. She includes a directory of ailments and emotional causes for each with a corresponding affirmation to help overcome the illness. For example, the probable cause of multiple sclerosis is "mental hardness, hard-heartedness, iron will, and inflexibility." The healing "thought pattern" would be: "By choosing loving, joyous thoughts, I created a loving joyous world. I am safe and free." <>--P. Randall Cohan	8176210773	9788176210775	Self Help,Non Fiction,Spirituality,Health,Spirituality > New Age,Self Help > Personal Development,Inspirational,Philosophy,Philosophy > Metaphysics	You_Can_Heal_Your_Life.jpg
Kane and Abel (Kane and Abel, #1)	Jeffrey Archer	Born on the same day near the turn of the century on opposite sides of the world, both men are brought together by fate and the quest of a dream. These two men -- ambitious, powerful, ruthless -- are locked in a relentless struggle to build an empire, fuelled by their all-consuming hatred. Over 60 years and three generations, through war, marriage, fortune, and disaster, Kane and Abel battle for the success and triumph that only one man can have.	0312995059	9780312995058	Fiction,Historical Fiction,Thriller,Drama,Mystery,Novels,Classics,Contemporary,Adult	Kane_and_Abel_(Kane_and_Abel,_#1).jpg
The Diary of a Young Girl	Anne Frank	Discovered in the attic in which she spent the last years of her life, Anne Frank's remarkable diary has since become a world classic—a powerful reminder of the horrors of war and an eloquent testament to the human spirit.<>In 1942, with Nazis occupying Holland, a thirteen-year-old Jewish girl and her family fled their home in Amsterdam and went into hiding. For the next two years, until their whereabouts were betrayed to the Gestapo, they and another family lived cloistered in the "Secret Annexe" of an old office building. Cut off from the outside world, they faced hunger, boredom, the constant cruelties of living in confined quarters, and the ever-present threat of discovery and death.<>In her diary Anne Frank recorded vivid impressions of her experiences during this period. By turns thoughtful, moving, and amusing, her account offers a fascinating commentary on human courage and frailty and a compelling self-portrait of a sensitive and spirited young woman whose promise was tragically cut short.	0553296981	9780553296983	Non Fiction,Classics,Biography,History,Autobiography > Memoir,World War II > Holocaust,Biography > Autobiography,War,Academic > School	The_Diary_of_a_Young_Girl.jpg
In His Steps	Charles M. Sheldon	A classic short Christian novel about the events that ensue when a preacher challenges his congregation to ask themselves, in their decisions about daily life, the simple question, "What would Jesus do?"	1557488150	9781557488152	Christian,Fiction,Christian Fiction,Classics,Religion,Religion > Christianity,Religion > Faith,Religion > Theology,Inspirational	In_His_Steps.jpg
To Kill a Mockingbird	Harper Lee	The unforgettable novel of a childhood in a sleepy Southern town and the crisis of conscience that rocked it, <>To Kill A Mockingbird<> became both an instant bestseller and a critical success when it was first published in 1960. It went on to win the Pulitzer Prize in 1961 and was later made into an Academy Award-winning film, also a classic.<>Compassionate, dramatic, and deeply moving, <>To Kill A Mockingbird<> takes readers to the roots of human behavior - to innocence and experience, kindness and cruelty, love and hatred, humor and pathos.	0061120081	9780061120084	Classics,Fiction,Historical Fiction,Academic > School,Literature,Young Adult,Academic > Read For School,Novels,Book Club	To_Kill_a_Mockingbird.jpg
Valley of the Dolls	Jacqueline Susann	Dolls: red or black; capsules or tablets; washed down with vodka or swallowed straight-for Anne, Neely, and Jennifer, it doesn't matter, as long as the pill bottle is within easy reach. These three women become best friends when they are young and struggling in New York City and then climb to the top of the entertainment industry-only to find that there is no place left to go but down-into the Valley of the Dolls.	0739418378	9780739418376	Fiction,Classics,Womens Fiction > Chick Lit,Romance,Book Club,Contemporary	Valley_of_the_Dolls.jpg
Gone with the Wind	Margaret Mitchell	Gone with the Wind is a novel written by Margaret Mitchell, 1st published in 1936. The story is set in Clayton County, GA, & Atlanta during the American Civil War & Reconstruction era. It depicts the experiences of Scarlett O'Hara, the spoiled daughter of a well-to-do plantation owner, who must use every means at her disposal to come out of the poverty she finds herself in after Sherman's March to the Sea. A historical novel, the story is a Bildungsroman or coming-of-age story, with the title taken from a poem written by Ernest Dowson. Gone with the Wind was popular with American readers from the onset & was the top American fiction bestseller in the year it was published & in 1937. As of 2014, a Harris poll found it to be the 2nd favorite book by American readers, just behind the Bible. More than 30 million copies have been printed worldwide.	0446675539	9780446675536	Classics,Historical Fiction,Fiction,Romance,Literature,Romance > Historical Romance,War,Military History > Civil War,Novels	Gone_with_the_Wind.jpg
One Hundred Years of Solitude	Gabriel Garcí­a Márquez	One of the 20th century's enduring works, <>One Hundred Years of Solitude<> is a widely beloved and acclaimed novel known throughout the world, and the ultimate achievement of a Nobel Prize winning career.<>The novel tells the story of the rise and fall of the mythical town of Macondo through the history of the family. It is a rich and brilliant chronicle of life and death, and the tragicomedy of humankind. In the noble, ridiculous, beautiful, and tawdry story of the family, one sees all of humanity, just as in the history, myths, growth, and decay of Macondo, one sees all of Latin America.<>Love and lust, war and revolution, riches and poverty, youth and senility -- the variety of life, the endlessness of death, the search for peace and truth -- these universal themes dominate the novel. Whether he is describing an affair of passion or the voracity of capitalism and the corruption of government, Gabriel Garcia Marquez always writes with the simplicity, ease, and  purity that are the mark of a master.<>Alternately reverential and comical, <>One Hundred Years of Solitude<> weaves the political, personal, and spiritual to bring a new consciousness to storytelling. Translated into dozens of languages, this stunning work is no less than an accounting of the history of the human race.	0060531045	9780060531041	Fiction,Classics,Magical Realism,Literature,Novels,Fantasy,Historical Fiction,European Literature > Spanish Literature	One_Hundred_Years_of_Solitude.jpg
The Purpose Driven Life: What on Earth Am I Here for?	Rick Warren	A #1 New York Times bestseller, The Purpose Driven Life will help you understand why you are alive and reveal God's amazing plan for you both here and now, and for eternity. Rick Warren will guide you through a personal forty-day spiritual journey that will transform your answer to life's most important question: What on earth am I here for? Knowing God's purpose for creating you will reduce your stress, focus your energy, simplify your decisions, give meaning to your life, and most important, prepare you for eternity. <>Movie stars and political leaders aren't the only ones turning to Rick Warren for spiritual guidance. Millions of people from NBA and LPGA players to corporate executives to high school students to prison inmates meet regularly to discuss The Purpose Driven Life.	0310276993	9780310276999	Non Fiction,Religion,Spirituality,Self Help,Religion > Christianity,Religion > Faith,Christian,Religion > Theology	The_Purpose_Driven_Life:_What_on_Earth_Am_I_Here_for?.jpg
The Thorn Birds	Colleen McCullough	Powered by the dreams and struggles of three generations, THE THORN BIRDS is the epic saga of a family rooted in the Australian sheep country.  At the story's heart is the love of Meggie Cleary, who can never possess the man she desperately adores, and Ralph de Bricassart, who rises from parish priest to the inner circles of the Vatican...but whose passion for Meggie will follow him all the days of his life.	0380018179	9780380018178	Fiction,Historical Fiction,Romance,Cultural > Australia,Classics,Romance > Historical Romance,Womens Fiction > Chick Lit,Novels,Drama	The_Thorn_Birds.jpg
The Revolt of Mamie Stover	William Bradford Huie	This is what happened to Mamie Stover, a six-foot tall girl from Mississippi, with a shock of yellow hair and a determination to get rich and respectable.  She won a beauty contest, got tossed out of Hollywood and landed in Honolulu, where with the assistance of a war and the U.S. Army she made her pile -- and an indelible impression on thousands of American fighting men.<>Here is a vivid, angry novel that exposes the corruption and decadence that produces girls like Mamie Stover.	0451009592	9780451009593		The_Revolt_of_Mamie_Stover.jpg
The Girl with the Dragon Tattoo (Millennium, #1)	Stieg Larsson	Mikael Blomkvist, a once-respected financial journalist, watches his professional life rapidly crumble around him. Prospects appear bleak until an unexpected (and unsettling) offer to resurrect his name is extended by an old-school titan of Swedish industry. The catch—and there's always a catch—is that Blomkvist must first spend a year researching a mysterious disappearance that has remained unsolved for nearly four decades. With few other options, he accepts and enlists the help of investigator Lisbeth Salander, a misunderstood genius with a cache of authority issues. Little is as it seems in Larsson's novel, but there is at least one constant: you really don't want to mess with the girl with the dragon tattoo.	0307269752	9780307269751	Book Club,Suspense,Thriller > Mystery Thriller,Contemporary,Adult,Adult Fiction,Mystery,Novels,Thriller	The_Girl_with_the_Dragon_Tattoo_(Millennium,_#1).jpg
The Very Hungry Caterpillar	Eric Carle	Suitable for children, this title covers colourful collage illustrations and its deceptively simply, hopeful story. It features die-cut pages and finger-sized holes to explore.	0241003008	9780241003008	Childrens,Childrens > Picture Books,Fiction	The_Very_Hungry_Caterpillar.jpg
The Late Great Planet Earth	Hal Lindsey	The impact of The Late Great Planet Earth cannot be overstated. The New York Times called it the "no. 1 non-fiction bestseller of the decade." For Christians and non-Christians of the 1970s, Hal Lindsey's blockbuster served as a wake-up call on events soon to come and events already unfolding -- all leading up to the greatest event of all: the return of Jesus Christ. The years since have confirmed Lindsey's insights into what biblical prophecy says about the times we live in. Whether you're a church-going believer or someone who wouldn't darken the door of a Christian institution, the Bible has much to tell you about the imminent future of this planet. In the midst of an out-of-control generation, it reveals a grand design that's unfolding exactly according to plan. The rebirth of Israel. The threat of war in the Middle East. An increase in natural catastrophes. The revival of Satanism and witchcraft. These and other signs, foreseen by prophets from Moses to Jesus, portend the coming of an antichrist . . . of a war which will bring humanity to the brink of destruction . . . and of incredible deliverance for a desperate, dying planet.	031027771X	0025986277710	Religion,Christian,Non Fiction,Religion > Theology,Religion > Christianity	The_Late_Great_Planet_Earth.jpg
Who Moved My Cheese?	Spencer Johnson	Written by Spencer Johnson, coauthor of <>The One Minute Manager<>, this enlightening and amusing story illustrates the vital importance of being able to deal with unexpected change. <>Who Moved My Cheese<>? is often distributed by managers to employees as a motivational tool, but the lessons it teaches can benefit literally anyone, young or old, rich or poor, looking for less stress and more success in every aspect of work and life.	0091883768	9780091883768	Non Fiction,Business,Self Help,Psychology,Leadership,Management,Philosophy,Self Help > Personal Development,Inspirational	Who_Moved_My_Cheese?.jpg
The Wind in the Willows	Kenneth Grahame	One of the most celebrated works of classic literature for children<>Meet little Mole, willful Ratty, Badger the perennial bachelor, and petulant Toad. In the almost one hundred years since their first appearance in 1908, they've become emblematic archetypes of eccentricity, folly, and friendship. And their misadventures-in gypsy caravans, stolen sports cars, and their Wild Wood-continue to capture readers' imaginations and warm their hearts long after they grow up. Begun as a series of letters from Kenneth Grahame to his son, <>The Wind in the Willows<> is a timeless tale of animal cunning and human camaraderie. This Penguin Classics edition features an appendix of the letters in which Grahame first related the exploits of Toad.	0143039091	9780143039099	Classics,Fiction,Childrens,Fantasy,Young Adult,Animals,Adventure,Literature,Childrens > Juvenile	The_Wind_in_the_Willows.jpg
1984	George Orwell	Written in 1948, <>1984<> was George Orwell's chilling prophecy about the future.<>While 1984 has come and gone, Orwell's narrative is more timely that ever. <>1984<> presents a "negative utopia", that is at once a startling and haunting vision of the world — so powerful that it's completely convincing from start to finish. No one can deny the power of this novel, its hold on the imaginations of entire generations of readers, or the resiliency of its admonitions — a legacy that seems to grow, not lessen, with the passage of time.	0451524934	9780451524935	Classics,Fiction,Science Fiction,Science Fiction > Dystopia,Literature,Novels,Academic > School	1984.jpg
The 7 Habits of Highly Effective People: Powerful Lessons in Personal Change	Stephen R. Covey	In <>The 7 Habits of Highly Effective People,<> author Stephen R. Covey presents a holistic, integrated, principle-centered approach for solving personal and professional problems. With penetrating insights and pointed anecdotes, Covey reveals a step-by-step pathway for living with fairness, integrity, service, and human dignity -- principles that give us the security to adapt to change and the wisdom and power to take advantage of the opportunities that change creates.	0743269519	9780743269513	Non Fiction,Self Help,Business,Psychology,Leadership,Self Help > Personal Development,Management,Productivity	The_7_Habits_of_Highly_Effective_People:_Powerful_Lessons_in_Personal_Change.jpg
The Celestine Prophecy (Celestine Prophecy, #1)	James Redfield	You have never read a book like this before.<>The Celestine Prophecy contains secrets that are currently changing our world. Drawing on ancient wisdom, it tells you how to make connections among the events happening in your own life right now...<>and lets you see what is going to happen to you in the years to come!<>A book that has been passed from hand to hand, from friend to friend, since it first appeared in small bookshops across America, <>The Celestine Prophecy<> is a work that has come to light at a time when the world deeply needs to read its words. The story it tells is a gripping one of adventure and discovery, but it is also a guidebook that has the power to crystallize your perceptions of why you are where you are in life...and to direct your steps with a new energy and optimism as you head into tomorrow.	0446671002	9780446671002	Fiction,Spirituality,Spirituality > New Age,Self Help,Religion,Fantasy,Inspirational,Adventure,Novels	The_Celestine_Prophecy_(Celestine_Prophecy,_#1).jpg
The Hunger Games (The Hunger Games, #1)	Suzanne Collins	Winning will make you famous. <>Losing means certain death.<>The nation of Panem, formed from a post-apocalyptic North America, is a country that consists of a wealthy Capitol region surrounded by 12 poorer districts. Early in its history, a rebellion led by a 13th district against the Capitol resulted in its destruction and the creation of an annual televised event known as the Hunger Games. In punishment, and as a reminder of the power and grace of the Capitol, each district must yield one boy and one girl between the ages of 12 and 18 through a lottery system to participate in the games. The 'tributes' are chosen during the annual Reaping and are forced to fight to the death, leaving only one survivor to claim victory.<>When 16-year-old Katniss's young sister, Prim, is selected as District 12's female representative, Katniss volunteers to take her place. She and her male counterpart Peeta, are pitted against bigger, stronger representatives, some of whom have trained for this their whole lives. , she sees it as a death sentence. But Katniss has been close to death before. For her, survival is second nature.	0439023483	9780439023481	Young Adult,Fiction,Science Fiction > Dystopia,Fantasy,Science Fiction,Romance,Adventure	The_Hunger_Games_(The_Hunger_Games,_#1).jpg
The Godfather	Mario Puzo	More than thirty years ago, a classic was born. A searing novel of the Mafia underworld, <>The Godfather<> introduced readers to the first family of American crime fiction, the Corleones, and the powerful legacy of tradition, blood, and honor that was passed on from father to son. With its themes of the seduction of power, the pitfalls of greed, and family allegiance, it resonated with millions of readers across the world—and became the definitive novel of the virile, violent subculture that remains steeped in intrigue, in controversy, and in our collective consciousness.	0451205766	9780451205766	Fiction,Classics,Mystery > Crime,Thriller,Historical Fiction,Mystery,Novels,Drama	The_Godfather.jpg
Love Story (Love Story, #1)	Erich Segal	Oliver Barrett IV, a wealthy jock from a stuffy WASP family on his way to a Harvard degree and a career in law . . . Jenny Cavilleri, a sharp-tongued, working-class beauty studying music at Radcliffe . . .<>Opposites in nearly every way, Oliver and Jenny are kindred spirits from vastly different worlds. Falling deeply and powerfully, their attraction to one another defies everything they have ever believed—as they share a passion far greater than anything they dreamed possible . . . and explore the wonder of a love that must end too soon.<>One of the most adored novels of our time, this is the book that defined a generation—a story of uncompromising devotion, of life as it really is . . . and love that changes everything.	0380017601	9780380017607	Romance,Fiction,Classics,Womens Fiction > Chick Lit,Novels,Contemporary,Love,Romance > Love Story,Drama	Love_Story_(Love_Story,_#1).jpg
